{
  "$schema": "https://galyarder-design.ai/schemas/plugin.v1.json",
  "specVersion": "1.0.0",
  "name": "video-template-toaster-rocket-jumpscare",
  "title": "Toaster Rocket Jumpscare",
  "version": "0.1.0",
  "description": "A prompt for a realistic home-video style shot of an old man being jumpscared by a toaster launching bread like a rocket.",
  "license": "CC-BY-4.0",
  "author": {
    "name": "Marin",
    "url": "https://x.com/MarinMethod/status/2049140113343394003"
  },
  "homepage": "https://github.com/YouMind-OpenLab/awesome-seedance-2-prompts",
  "tags": [
    "video-template",
    "first-party",
    "video",
    "general",
    "food"
  ],
  "gd": {
    "kind": "scenario",
    "taskKind": "new-generation",
    "mode": "video",
    "scenario": "video",
    "surface": "video",
    "preview": {
      "type": "video",
      "poster": "https://customer-qs6wnyfuv0gcybzj.cloudflarestream.com/fbf9f399fd8f4905a62661966d937ba8/thumbnails/thumbnail.jpg",
      "video": "https://customer-qs6wnyfuv0gcybzj.cloudflarestream.com/fbf9f399fd8f4905a62661966d937ba8/downloads/default.mp4"
    },
    "useCase": {
      "query": {
        "en": "A realistic shot of an old man in a cozy kitchen being jumpscared when his toaster launches the bread five feet into the air like a rocket. Handheld \"home video\" style capturing his genuine look of shock and the bread hitting the ceiling.A realistic shot of an old man in a cozy kitchen being jumpscared when his toaster launches the bread five feet into the air like a rocket. Handheld \"home video\" style capturing his genuine look of shock and the bread hitting the ceiling."
      }
    },
    "inputs": [
      {
        "name": "model",
        "label": "Model",
        "type": "select",
        "options": [
          "seedance-2.0"
        ],
        "default": "seedance-2.0"
      },
      {
        "name": "aspect",
        "label": "Aspect ratio",
        "type": "select",
        "options": [
          "16:9",
          "9:16",
          "1:1",
          "4:5"
        ],
        "default": "16:9"
      }
    ],
    "context": {
      "assets": [
        "./template.json"
      ]
    },
    "pipeline": {
      "stages": [
        {
          "id": "generate",
          "atoms": [
            "video-generate"
          ]
        }
      ]
    },
    "capabilities": [
      "prompt:inject",
      "media:video-generate"
    ]
  }
}
