{
  "$schema": "https://galyarder-design.ai/schemas/plugin.v1.json",
  "specVersion": "1.0.0",
  "name": "image-template-profile-avatar-monochrome-studio-portrait",
  "title": "Profile / Avatar - Monochrome Studio Portrait",
  "version": "0.1.0",
  "description": "A high-end commercial photography prompt for a monochrome portrait with a distinctive split-background and dramatic studio lighting.",
  "license": "CC-BY-4.0",
  "author": {
    "name": "K",
    "url": "https://x.com/ChillaiKalan__/status/2048828505497198838"
  },
  "homepage": "https://github.com/YouMind-OpenLab/awesome-gpt-image-2",
  "tags": [
    "image-template",
    "first-party",
    "image",
    "profile-avatar",
    "portrait",
    "cinematic"
  ],
  "gd": {
    "kind": "scenario",
    "taskKind": "new-generation",
    "mode": "image",
    "scenario": "image",
    "surface": "image",
    "preview": {
      "type": "image",
      "poster": "https://cms-assets.youmind.com/media/1777367273368_hp9n0c_HG7mqKmb0AA1ecq.jpg"
    },
    "useCase": {
      "query": {
        "en": "A stunning black and white studio portrait of {argument name=\"subject\" default=\"uploaded person\"}. Eye-level medium shot, framed from the waist up. The subject is standing with his arms casually but firmly crossed over his chest. He is looking downward and slightly off-camera to the left with a calm, contemplative posture. He is wearing a {argument name=\"outfit\" default=\"dark, heavy-textured waffle-knit long-sleeve sweater\"} and a delicate silver chain necklace with a small pendant. He is wearing a classic analog watch with a light dial and leather strap on the lower arm. The background is a {argument name=\"background style\" default=\"stark, graphic vertical split: pure white on the left half and pure deep black on the right half\"}. High-end commercial photography, monochrome masterpiece. Soft but dramatic directional studio lighting originating from the left, highlighting the textures of the clothing and skin while casting natural, smooth shadows on the right side. Crisp focus, hyper-realistic,8k resolution, cinematic composition. ar 4:5"
      }
    },
    "inputs": [
      {
        "name": "model",
        "label": "Model",
        "type": "select",
        "options": [
          "gpt-image-2"
        ],
        "default": "gpt-image-2"
      },
      {
        "name": "aspect",
        "label": "Aspect ratio",
        "type": "select",
        "options": [
          "1:1",
          "16:9",
          "9:16",
          "4:5",
          "3:2"
        ],
        "default": "1:1"
      }
    ],
    "context": {
      "assets": [
        "./template.json"
      ]
    },
    "pipeline": {
      "stages": [
        {
          "id": "generate",
          "atoms": [
            "image-generate"
          ]
        }
      ]
    },
    "capabilities": [
      "prompt:inject",
      "media:image-generate"
    ]
  }
}
