{
  "$schema": "https://galyarder-design.ai/schemas/plugin.v1.json",
  "specVersion": "1.0.0",
  "name": "example-html-ppt-zhangzara-grove",
  "title": "Html Ppt Zhangzara Grove",
  "version": "0.1.0",
  "description": "Grove — Forest-green canvas with cream type, classical Playfair serifs, and a single rust accent. Anything that should feel organic, considered, and grown-up: sustainability and wellness brands, outdoor / nature products, wineries and restaurants, literary or arts decks, advisory deliverables, bilingual EN/CN reports.",
  "license": "MIT",
  "author": {
    "name": "Galyarder Design",
    "url": "https://github.com/galyarderlabs"
  },
  "homepage": "https://github.com/galyarderlabs/galyarder-design/tree/main/plugins/_official/examples/html-ppt-zhangzara-grove",
  "tags": [
    "example",
    "first-party",
    "deck",
    "marketing",
    "web",
    "grove",
    "zhangzara-grove",
    "organic",
    "considered",
    "classical",
    "warm",
    "sustainability-brand",
    "wellness-brand",
    "html-deck",
    "html-slides",
    "zhangzara"
  ],
  "compat": {
    "agentSkills": [
      {
        "path": "./SKILL.md"
      }
    ]
  },
  "gd": {
    "kind": "scenario",
    "taskKind": "new-generation",
    "mode": "deck",
    "scenario": "marketing",
    "surface": "web",
    "preview": {
      "type": "html",
      "entry": "./example.html"
    },
    "useCase": {
      "query": {
        "en": "Grove — Forest-green canvas with cream type, classical Playfair serifs, and a single rust accent. Anything that should feel organic, considered, and grown-up: sustainability and wellness brands, outdoor / nature products, wineries and restaurants, literary or arts decks, advisory deliverables, bilingual EN/CN reports."
      },
      "exampleOutputs": [
        {
          "path": "./example.html",
          "title": "Html Ppt Zhangzara Grove"
        }
      ]
    },
    "context": {
      "skills": [
        {
          "path": "./SKILL.md"
        }
      ],
      "assets": [
        "./example.html"
      ]
    },
    "pipeline": {
      "stages": [
        {
          "id": "generate",
          "atoms": [
            "file-write",
            "live-artifact"
          ]
        }
      ]
    },
    "capabilities": [
      "prompt:inject",
      "fs:write"
    ]
  }
}
