{
  "$schema": "https://galyarder-design.ai/schemas/plugin.v1.json",
  "specVersion": "1.0.0",
  "name": "video-template-beat-synced-outfit-transformation-dance",
  "title": "Beat-Synced Outfit Transformation Dance",
  "version": "0.1.0",
  "description": "A prompt for Seedance 2.0 that coordinates a character dance following breakdown frames while performing a beat-synced outfit change.",
  "license": "CC-BY-4.0",
  "author": {
    "name": "Kashberg",
    "url": "https://x.com/Kashberg_0/status/2049074008730247669"
  },
  "homepage": "https://github.com/YouMind-OpenLab/awesome-seedance-2-prompts",
  "tags": [
    "video-template",
    "first-party",
    "video",
    "general",
    "fantasy"
  ],
  "gd": {
    "kind": "scenario",
    "taskKind": "new-generation",
    "mode": "video",
    "scenario": "video",
    "surface": "video",
    "preview": {
      "type": "video",
      "poster": "https://pbs.twimg.com/media/HG_FqHJboAA5vAe.jpg"
    },
    "useCase": {
      "query": {
        "en": "Have the character from Image 1 perform the dance based on the breakdown in Image 3. During the performance, include a beat-synced transformation into the character from Image 2. After the transformation, the character from Image 2 continues and completes the remaining dance steps from Image 3. Emphasize precise beat matching with the music"
      }
    },
    "inputs": [
      {
        "name": "model",
        "label": "Model",
        "type": "select",
        "options": [
          "seedance-2.0"
        ],
        "default": "seedance-2.0"
      },
      {
        "name": "aspect",
        "label": "Aspect ratio",
        "type": "select",
        "options": [
          "16:9",
          "9:16",
          "1:1",
          "4:5"
        ],
        "default": "16:9"
      }
    ],
    "context": {
      "assets": [
        "./template.json"
      ]
    },
    "pipeline": {
      "stages": [
        {
          "id": "generate",
          "atoms": [
            "video-generate"
          ]
        }
      ]
    },
    "capabilities": [
      "prompt:inject",
      "media:video-generate"
    ]
  }
}
