{
  "$schema": "https://galyarder-design.ai/schemas/plugin.v1.json",
  "specVersion": "1.0.0",
  "name": "gd-design-refine",
  "title": "Design refine",
  "version": "0.1.0",
  "description": "Baseline Refine plugin for improving an existing Galyarder Design artifact with a focused critique, small patch, and handoff summary.",
  "license": "MIT",
  "author": {
    "name": "Galyarder Design",
    "url": "https://github.com/galyarderlabs"
  },
  "homepage": "https://github.com/galyarderlabs/galyarder-design/tree/main/plugins/_official/scenarios/gd-design-refine",
  "tags": [
    "scenario",
    "first-party",
    "refine",
    "tune",
    "review",
    "critique",
    "patch-edit"
  ],
  "compat": {
    "agentSkills": [
      {
        "path": "./SKILL.md"
      }
    ]
  },
  "gd": {
    "kind": "scenario",
    "taskKind": "tune-collab",
    "scenario": "design-refine",
    "mode": "refine",
    "context": {
      "skills": [
        {
          "path": "./SKILL.md"
        }
      ]
    },
    "pipeline": {
      "stages": [
        {
          "id": "direction",
          "atoms": [
            "direction-picker"
          ]
        },
        {
          "id": "patch",
          "atoms": [
            "patch-edit"
          ]
        },
        {
          "id": "critique",
          "atoms": [
            "critique-theater"
          ],
          "repeat": true,
          "until": "critique.score>=4 || iterations>=3"
        },
        {
          "id": "handoff",
          "atoms": [
            "handoff"
          ]
        }
      ]
    },
    "capabilities": [
      "prompt:inject",
      "fs:read",
      "fs:write"
    ],
    "useCase": {
      "query": {
        "en": "Refine the existing artifact: {{refineGoal}}. Make the smallest useful design patch, critique it against the current design system, iterate until the score converges, then hand off the change summary."
      },
      "exampleOutputs": []
    },
    "inputs": [
      {
        "name": "refineGoal",
        "type": "string",
        "required": false,
        "label": "Refine goal",
        "placeholder": "make this landing page feel more premium and focused"
      },
      {
        "name": "direction",
        "type": "string",
        "required": false,
        "label": "Direction",
        "placeholder": "more editorial / more enterprise / more playful"
      }
    ]
  }
}
