{
  "$schema": "https://galyarder-design.ai/schemas/plugin.v1.json",
  "specVersion": "1.0.0",
  "name": "video-template-cinematic-dragon-interaction-flight",
  "title": "Cinematic Dragon Interaction & Flight",
  "version": "0.1.0",
  "description": "A detailed storyboard-style prompt for a video featuring a woman's emotional interaction with a dragon followed by a cinematic flight sequence.",
  "license": "CC-BY-4.0",
  "author": {
    "name": "simply",
    "url": "https://x.com/kingofdairyque/status/2049052738924023976"
  },
  "homepage": "https://github.com/YouMind-OpenLab/awesome-seedance-2-prompts",
  "tags": [
    "video-template",
    "first-party",
    "video",
    "cinematic",
    "fantasy",
    "action"
  ],
  "gd": {
    "kind": "scenario",
    "taskKind": "new-generation",
    "mode": "video",
    "scenario": "video",
    "surface": "video",
    "preview": {
      "type": "video",
      "poster": "https://customer-qs6wnyfuv0gcybzj.cloudflarestream.com/f72b7a26635bdf580a2899bf2682f7f6/thumbnails/thumbnail.jpg",
      "video": "https://customer-qs6wnyfuv0gcybzj.cloudflarestream.com/f72b7a26635bdf580a2899bf2682f7f6/downloads/default.mp4"
    },
    "useCase": {
      "query": {
        "en": "STYLE Handheld + aerial camera blend Soft motion blur (only during fast transitions) Teal–orange cinematic grade Cool tones during dragon moments, warm tones at emotional peak ⏱ TIMELINE (15s) 0–2s (HOOK) Close-up on woman standing at a cliff Wind moving through hair A giant shadow passes over her → she slowly turns Low rumble builds tension 2–5s (CONNECTION) Dragon lands behind her with heavy presence It lowers its head slowly She hesitates, then touches its face Wind + dust particles react subtly Quiet emotional moment (no aggression) 5–8s (TAKEOFF) She climbs onto its back Dragon launches powerfully into the sky Camera follows upward, slight rotation Clouds rush past, strong sense of speed 8–12s (FLIGHT SEQUENCE) Fast but controlled cuts: Flying through clouds Passing mountain peaks Close-up of wings moving Her expression shifting to awe Wide aerial shot showing scale 12–15s (FINAL MOMENT) Above the clouds in golden light Dragon slows and stabilizes She stands confidently on its back Wide cinematic shot → calm, powerful ending"
      }
    },
    "inputs": [
      {
        "name": "model",
        "label": "Model",
        "type": "select",
        "options": [
          "seedance-2.0"
        ],
        "default": "seedance-2.0"
      },
      {
        "name": "aspect",
        "label": "Aspect ratio",
        "type": "select",
        "options": [
          "16:9",
          "9:16",
          "1:1",
          "4:5"
        ],
        "default": "16:9"
      }
    ],
    "context": {
      "assets": [
        "./template.json"
      ]
    },
    "pipeline": {
      "stages": [
        {
          "id": "generate",
          "atoms": [
            "video-generate"
          ]
        }
      ]
    },
    "capabilities": [
      "prompt:inject",
      "media:video-generate"
    ]
  }
}
