{
  "$schema": "https://galyarder-design.ai/schemas/plugin.v1.json",
  "specVersion": "1.0.0",
  "name": "video-template-traditional-dance-performance",
  "title": "Traditional Dance Performance",
  "version": "0.1.0",
  "description": "A comprehensive video prompt for Seedance 2.0 to generate a graceful traditional dance based on choreography and identity reference images.",
  "license": "CC-BY-4.0",
  "author": {
    "name": "Sydney",
    "url": "https://x.com/XSydneyFan/status/2049170241247449316"
  },
  "homepage": "https://github.com/YouMind-OpenLab/awesome-seedance-2-prompts",
  "tags": [
    "video-template",
    "first-party",
    "video",
    "advertising",
    "cinematic",
    "fantasy",
    "action"
  ],
  "gd": {
    "kind": "scenario",
    "taskKind": "new-generation",
    "mode": "video",
    "scenario": "video",
    "surface": "video",
    "preview": {
      "type": "video",
      "poster": "https://pbs.twimg.com/media/HHAdco5aQAAtTCa.jpg"
    },
    "useCase": {
      "query": {
        "en": "Use the first reference image as the exact choreography and motion-process guide. Use the second reference image as the identity reference for the adult woman dancer.\n\nCreate a graceful traditional dance performance that follows all 16 illustrated steps in order, from the confident opening pose to the respectful closing pose. The dancer performs with poised posture, soft knee bends, precise cross steps, elegant wrist waves, curved fingers, shoulder accents, hip sways, flowing turns, and expressive selendang sweeps.\n\nKeep the camera in a clean full-body cinematic frame, mostly front-facing, with slow controlled movement that supports the dance instead of distracting from it. During the left and right turns, allow a subtle circular camera drift, then return to a centered frontal composition. The dancer’s hands, feet, facial expression, and selendang fabric must remain visible throughout.\n\nUse soft studio lighting, refined contrast, and a calm traditional performance atmosphere. The motion should feel smooth, rhythmic, respectful, and feminine, with the selendang floating naturally as the dancer glides forward and backward. End on a still closing pose with hands at the heart, peaceful smile, and elegant silence."
      }
    },
    "inputs": [
      {
        "name": "model",
        "label": "Model",
        "type": "select",
        "options": [
          "seedance-2.0"
        ],
        "default": "seedance-2.0"
      },
      {
        "name": "aspect",
        "label": "Aspect ratio",
        "type": "select",
        "options": [
          "16:9",
          "9:16",
          "1:1",
          "4:5"
        ],
        "default": "16:9"
      }
    ],
    "context": {
      "assets": [
        "./template.json"
      ]
    },
    "pipeline": {
      "stages": [
        {
          "id": "generate",
          "atoms": [
            "video-generate"
          ]
        }
      ]
    },
    "capabilities": [
      "prompt:inject",
      "media:video-generate"
    ]
  }
}
